results/gscdb/job0003_GAS22_datasets/params.json

{"cx": [0.862139736374172, 0.936993691972698, 0.317533683085033], "css": [-4.10753796482853, -5.24218990333846, -1.76643208454076, 7.5380689617542], "cos": [0.805124374375355, 7.98909430970845, -1.76098915061634, -7.54815900595292, 2.00093961824784]}

results/syfes/REPORT.md

### form 0

- f_x: `c0 + c1*w + c2*gamma_utransform*x2/(gamma_utransform*x2 + 1.0)`
- f_css: `c0*w + c1*w**2 + c2*gamma_utransform**6*x2**6/(gamma_utransform*x2 + 1.0)**6 + c3*gamma_utransform**6*w**4*x2**6/(gamma_utransform*x2 + 1.0)**6 + gamma_utransform*x2/(gamma_utransform*x2 + 1.0)`
- f_cos: `c0 + c1*w**2 + c2*w**2*x2**(1/3) + c3*w**6 + c4*w**6*x2**(1/3)`
- params: f_x.c0=0.86214, f_x.c1=0.317534, f_x.c2=0.936994, f_x.gamma_utransform=0.00384062, f_css.c0=-4.10754, f_css.c1=-5.24219, f_css.c2=-1.76643, f_css.c3=7.53807, f_css.gamma_utransform=0.46914, f_cos.c0=0.805124, f_cos.c1=7.98909, f_cos.c2=-1.76099, f_cos.c3=-7.54816, f_cos.c4=2.00094